no,jp,en,slots,video,lv,note,scene,hint_1,hint_2,explain_meaning,explain_nuance,explain_grammar,similars
381,それは私の優先事項ではありません。,That's not my priority.,,2,1,優先順位が低い。,work,priority を使う,not を使う,それを優先していないことを伝える,重要度が低いことを示す,priority は「優先事項」という名詞,Not my focus|Not important to me|Low on my list
382,それで大丈夫です。,I'm fine with that.,,2,1,問題なく受け入れ。,daily,fine を使う,with that を使う,その提案に問題ないと伝える,同意や承認を示すカジュアル表現,I'm fine with は「〜で大丈夫」,That's okay|I'm good with that|No problem
383,できればしたくありません。,I'd prefer not to.,,2,1,丁寧な拒否。,daily,prefer を使う,not to を使う,できれば避けたいと丁寧に伝える,直接的な拒否を避ける表現,I'd prefer は I would prefer の短縮形,I'd rather not|I'd like to avoid that|Not my preference
384,どちらでも構いません。,I don't mind either way.,,2,1,どちらでもOK。,daily,mind を使う,either way を使う,どちらの選択肢でも問題ないと伝える,柔軟性を示す表現,either way は「どちらでも」,I'm fine either way|No preference|Up to you
385,それで大丈夫です。,That works for me.,,2,1,都合が良い。,work,works を使う,for me を使う,その提案が自分に都合良いと伝える,スケジュールや計画の承認,work for は「〜にとって都合が良い」,That's good for me|That suits me|I'm available
386,それで問題ありません。,I'm okay with it.,,2,1,承認を示す。,daily,okay を使う,with it を使う,その提案に問題ないと承認する,カジュアルな同意表現,be okay with は「〜で大丈夫」,I'm fine with it|That's alright|No issues
387,むしろ待ちたいです。,I'd rather wait.,,2,1,待つことを選択。,work,rather を使う,wait を使う,待つ方を好むと伝える,別の選択肢を好む意思表示,I'd rather は「むしろ〜したい」,I prefer to wait|I'd like to wait|Better to wait
388,それについて考えています。,I'm thinking about it.,,2,1,検討中。,daily,thinking を使う,about it を使う,現在検討中であることを伝える,決定までの猶予を示す,現在進行形で思考中を示す,I'm considering it|I'm mulling it over|Still thinking
389,まだ決めているところです。,I'm still deciding.,,2,1,決定プロセス中。,work,deciding を使う,still を使う,まだ決定の途中であることを伝える,判断に時間がかかっていることを示す,現在進行形で進行中を強調,Still making up my mind|Haven't decided|In the process
390,まだ決めていません。,I haven't decided yet.,,2,1,未決定。,daily,decided を使う,yet を使う,まだ決定していないことを明言する,決断までの時間を求める表現,haven't decided は現在完了の否定形,Not decided yet|Still undecided|No decision yet
391,試してみます。,I'll give it a try.,,2,1,挑戦する意思。,work,try を使う,give it a を使う,試してみる意志を示す,前向きな姿勢を表現,give it a try は「試してみる」という慣用表現,I'll try it|I'll test it|Worth a try
392,じっくり考えます。,I'll think it over.,,2,1,慎重に検討。,daily,think over を使う,I'll を使う,時間をかけて検討すると約束する,熟考する意思を示す,think over は「じっくり考える」という句動詞,I'll consider it|I'll reflect on it|I'll ponder it
393,後で連絡します。,I'll get back to you.,,2,1,後で返答。,work,get back を使う,to you を使う,後で返答すると約束する,ビジネスでの定番表現,get back to は「返答する」という句動詞,I'll contact you|I'll follow up|I'll reach out
394,私が対応します。,I'll take care of it.,,2,1,責任を持って処理。,work,take care を使う,of it を使う,自分が対応すると約束する,責任感を示す表現,take care of は「〜の面倒を見る」,I'll handle it|I'll manage it|I'll deal with it
395,なんとかします。,I'll figure it out.,,2,1,解決策を見つける。,daily,figure out を使う,I'll を使う,解決方法を見つけると約束する,問題解決の意志を示す,figure out は「理解する・解決する」,I'll work it out|I'll find a way|I'll solve it
396,様子を見ます。,I'll see how it goes.,,2,1,結果を見て判断。,daily,see を使う,how it goes を使う,やってみてから判断すると伝える,柔軟な対応を示す,see how it goes は「様子を見る」という慣用表現,I'll see what happens|Let's see|I'll wait and see
397,覚えておきます。,I'll keep that in mind.,,2,1,記憶にとどめる。,work,keep を使う,in mind を使う,その情報を覚えておくと約束する,アドバイスや情報を尊重する表現,keep in mind は「心に留める」という慣用表現,I'll remember that|I'll note that|I won't forget
398,最善を尽くします。,I'll do my best.,,2,1,努力を約束。,work,best を使う,do を使う,最大限の努力をすると約束する,誠実さを示す表現,do one's best は「最善を尽くす」,I'll try my hardest|I'll give it my all|I'll work hard
399,取り組んでいます。,I'm working on it.,,2,1,作業中。,work,working を使う,on it を使う,現在取り組んでいることを伝える,進行中であることを示す,work on は「〜に取り組む」という句動詞,I'm on it|I'm handling it|In progress
400,実現させます。,I'll make it happen.,,2,1,必ず達成。,work,make を使う,happen を使う,必ず実現させると約束する,強い意志と責任感を示す,make it happen は「実現させる」という慣用表現,I'll get it done|I'll ensure it|I'll deliver
401,これから始めます。,I'll start with this.,,2,1,出発点を示す。,work,start を使う,with this を使う,これを最初に取り組むと伝える,優先順位を示す表現,start with は「〜から始める」,I'll begin here|This is my starting point|First step
402,確認してみます。,I'll take a look.,,2,1,見てみる。,work,look を使う,take a を使う,確認してみると約束する,カジュアルな対応意志,take a look は「見てみる」という慣用表現,I'll check it|I'll review it|I'll examine it
403,それについて確認します。,I'll check on that.,,2,1,調査する。,work,check on を使う,that を使う,その件を確認すると約束する,情報確認の意志を示す,check on は「確認する」という句動詞,I'll look into it|I'll investigate|I'll verify
404,後でフォローします。,I'll follow up later.,,2,1,後で追跡。,work,follow up を使う,later を使う,後で続きを対応すると約束する,継続的な対応を示す,follow up は「フォローアップする」,I'll check back|I'll get back later|I'll circle back
405,このまま続けます。,I'll stick with it.,,2,1,継続の意思。,daily,stick を使う,with it を使う,このまま続ける意志を示す,粘り強さを表現,stick with は「〜を続ける」という句動詞,I'll continue|I'll keep going|I'll persist
406,必要に応じて調整します。,I'll adjust as needed.,,2,1,柔軟に対応。,work,adjust を使う,as needed を使う,状況に応じて調整すると約束する,柔軟性を示す表現,as needed は「必要に応じて」,I'll adapt|I'll modify|I'll change if necessary
407,後で対応します。,I'll handle it later.,,2,1,後回し対応。,work,handle を使う,later を使う,後で処理すると約束する,優先順位の調整を示す,handle は「処理する」という動詞,I'll deal with it later|I'll address it later|Later on that
408,もっと考えてみます。,I'll think about it more.,,2,1,さらに検討。,daily,more を使う,think about を使う,さらに深く考えると約束する,慎重な姿勢を示す,think about は「〜について考える」,I'll consider it further|I'll reflect more|I'll give it more thought
409,進捗をお知らせします。,I'll give you an update.,,2,1,状況報告を約束。,work,update を使う,give を使う,進捗を報告すると約束する,情報共有の意志を示す,give an update は「最新情報を伝える」,I'll keep you posted|I'll update you|I'll inform you
410,もう一度やってみます。,I'll try again.,,2,1,再挑戦。,daily,again を使う,try を使う,再度挑戦すると約束する,諦めない姿勢を示す,try again は「もう一度試す」,I'll retry|I'll give it another shot|I'll attempt again
